,Source,Datetime,Username,Review,Region
2959,Instagram yappakistan,2022-05-27 19:04:32,sahilsidsa,Hey I downloaded YAP but it doesn t available in Pakistan,
2960,Instagram yappakistan,2022-05-27 20:13:05,stalwartneophyte,Any timeline for launching,
2961,Instagram yappakistan,2022-05-28 09:25:10,itz_m_haseeb,burgopak make this earlier,
2962,Instagram yappakistan,2022-05-28 10:29:53,ali.taimoor.12382,When it is available,
2963,Instagram yappakistan,2022-05-28 15:25:54,jahanzaib_bhatti007,Pp,
2964,Instagram yappakistan,2022-05-28 20:07:52,saz__graphy,According to ur processing it seems like u guys gonna launch after a year these cards,
2965,Instagram yappakistan,2022-05-29 01:35:27,aliaamir_381,Waiting ,
2966,Instagram yappakistan,2022-05-29 10:04:29,hintplusstudio,Yeah it was the burgopak project,
2967,Instagram yappakistan,2022-05-30 10:13:13,ibraraliwarraich,Kab lunch ho raha yar,
2968,Instagram yappakistan,2022-05-30 10:13:48,ibraraliwarraich,Date bata dain chahy 6 month ka hi keh dain,
2969,Instagram yappakistan,2022-05-30 10:19:43,ndesignz99,,
2970,Instagram yappakistan,2022-05-30 10:28:29,snailmotions,Do you provide payment gateway,
2971,Instagram yappakistan,2022-06-02 01:40:56,_darbags,Your project is no different from Jazz Cash Easy Paisa Payit Wallet Liv Account etc Anyhow wish you best of luck,
2972,Instagram yappakistan,2022-06-02 09:24:40,imomerimran,Will your card be available for international transactions,
2973,Instagram yappakistan,2022-06-03 02:26:29,madnankhans,When available ,
2974,Instagram yappakistan,2022-06-03 17:38:34,goharmunir,Why copying sada pay,
2975,Instagram yappakistan,2022-06-22 04:42:37,fai_zz_an,malikahsanhamid hamid ijaz91,
2976,Instagram yappakistan,2022-07-03 03:29:42,gak92183212,,
2977,Instagram yappakistan,2022-07-03 16:41:24,gak92183212,,
2978,Instagram yappakistan,2022-05-26 07:36:44,_._._._._.aman_._._._._._._,Great work,
2979,Instagram yappakistan,2022-05-25 17:09:26,imusa02,How long the wait is gonna be  super excited,
2980,Instagram yappakistan,2022-05-25 17:12:17,usman_razzak_229,Color of shoes,
2981,Instagram yappakistan,2022-05-25 17:18:19,syedfaiqali1,There are 4 Differences,
2982,Instagram yappakistan,2022-05-25 17:34:48,syed.tahir92,There are 6 differences,
2983,Instagram yappakistan,2022-05-25 17:59:57,iambebilal,I think 7 difference ,
2984,Instagram yappakistan,2022-05-25 19:03:46,jawa.dulhaq,7 difference but easy with yap,
2985,Instagram yappakistan,2022-05-26 05:24:47,ahxankhan47,5 differences,
2986,Instagram yappakistan,2022-05-26 08:00:01,nabeelmustufa,5,
2987,Instagram yappakistan,2022-05-27 06:14:14,tahir.ch_sahab,6,
2988,Instagram yappakistan,2022-05-27 13:27:13,ruaaba25,6,
2989,Instagram yappakistan,2022-08-18 06:17:27,mahnam.khan16,8,
2990,Instagram yappakistan,2022-05-24 16:53:11,qalaxysmoothmilk,How much time will it take for the app to launch in Pakistan,
2991,Instagram yappakistan,2022-05-22 09:30:10,muneeb.__x,So when can we start pre registering,
2992,Instagram yappakistan,2022-05-22 10:38:24,nhussaiin7,,
2993,Instagram yappakistan,2022-05-22 11:02:12,eban.aftabdar,Registrations,
2994,Instagram yappakistan,2022-05-22 11:08:25,marhabaniazi,Woohoo Cant wait to YAP,
2995,Instagram yappakistan,2022-05-22 16:49:24,saad.mazhar_leo,Aa bhi jaao aa bhi jao aa bhi jaao,
2996,Instagram yappakistan,2022-05-22 18:38:02,mianmuhammadtayyabazam,,
2997,Instagram yappakistan,2022-05-22 19:39:08,sheikh.umair11,When you will start registration,
2998,Instagram yappakistan,2022-05-22 13:03:28,sugar_baby_0192,When is the launching date,
2999,Instagram yappakistan,2022-05-22 09:28:19,_.hassan16,So when are you going to launch the app cant wait,
3000,Instagram yappakistan,2022-05-22 14:02:18,azy.jasper,How do i register,
3001,Instagram yappakistan,2022-05-22 09:35:29,haxnain_haeder,,
3002,Instagram yappakistan,2022-05-22 09:47:10,salmanpash,Congratulations plz share details,
3003,Instagram yappakistan,2022-05-22 10:08:22,chzeeshanalee,,
3004,Instagram yappakistan,2022-05-22 11:00:35,zulqar.nayn,Please give date,
3005,Instagram yappakistan,2022-05-22 15:30:09,damangillani,Is there any exact date of launch,
3006,Instagram yappakistan,2022-05-19 07:24:56,sweetknowledgea2z,Congratulations ,
3007,Instagram yappakistan,2022-05-19 07:25:24,sweetknowledgea2z,So when to yap officially launched in Pakistan so excited ,
3008,Instagram yappakistan,2022-05-19 07:26:05,abdullah_sajid23,So i can register now,
3009,Instagram yappakistan,2022-05-19 07:34:37,imusa02,Congratulations,
3010,Instagram yappakistan,2022-05-19 07:42:10,asliaqs,Congratulations Mubarakan,
3011,Instagram yappakistan,2022-05-19 07:43:23,saad.mazhar_leo,Next year,
3012,Instagram yappakistan,2022-05-19 07:53:40,shayansaqlaini2,Very very congrats  i can t waiting for Create account,
3013,Instagram yappakistan,2022-05-19 08:24:38,haider.ali.shah1,Now we can create account in it or not,
3014,Instagram yappakistan,2022-05-19 09:34:32,ishtiaq.34,Congratulations ,
3015,Instagram yappakistan,2022-05-19 09:46:08,naghmaimran84,Congratulations,
3016,Instagram yappakistan,2022-05-19 10:14:47,k._.ayan,really cant wait to get my hands on the unique debit card ,
3017,Instagram yappakistan,2022-05-19 10:22:17,crushignored,yappakistan can you guys give any estimate that long will it take till I get my hands on yap card,
3018,Instagram yappakistan,2022-05-19 10:22:17,_itz._.dany,Congratulations ,
3019,Instagram yappakistan,2022-05-19 10:27:05,zulqarnain.malik313,Him i need some details on your product as to what it exactly is and how to apply for it,
3020,Instagram yappakistan,2022-05-19 10:50:20,kaleemullah_6867,Congratulations  Can t wait anymore but Patience is a virtue,
3021,Instagram yappakistan,2022-05-19 12:53:23,aimmenkhalidd,Bta b den ab,
3022,Instagram yappakistan,2022-05-19 12:56:48,fardankhalid1,When can i start Can I open under guardianship accounts for my children Theyre anxious to get their hands on debit cards,
3023,Instagram yappakistan,2022-05-19 13:11:28,dk.daniyalkhan,As soon as you launch I might get hands on one of your cards,
3024,Instagram yappakistan,2022-05-19 16:00:31,malik_writer_official,Congratulations Really Can t Wait To Get My Hands On The New Unique Debit Card ,
3025,Instagram yappakistan,2022-05-19 18:37:43,hs.javaid, Congratulations looking forward to see you lead the game,
3026,Instagram yappakistan,2022-05-19 20:44:27,israr_pakistan,Share notification of sbp ,
3027,Instagram yappakistan,2022-05-19 22:39:37,divalaxy,Can we use this for google payments,
3028,Instagram yappakistan,2022-05-20 00:20:56,mikramncm,Congratulations hope sing in start soon,
3029,Instagram yappakistan,2022-05-20 06:21:24,malix805, CONGRATULATIONS WAITING FOR THIS FOR LONG TIME ,
3030,Instagram yappakistan,2022-05-20 08:55:49,iamjunaidjutt_,yappakistan when will it be officially live in Pakistan Can t wait for my hands on yap card,
3031,Instagram yappakistan,2022-05-20 14:00:09,rayanaziz.11,there isn t an option to put Pakistani Number in App,
3032,Instagram yappakistan,2022-05-21 06:38:41,subscription_pk,Why u guys takings too much time to operate I can t wait anymore ,
3033,Instagram yappakistan,2022-05-21 06:43:03,syedtehrimabbas,,
3034,Instagram yappakistan,2022-05-21 07:00:18,anasalialamgir,Congratulations yappakistan So excited for you guys But what does this mean for the customers When will we get to sign up,
3035,Instagram yappakistan,2022-05-21 12:20:06,psychrophile0,When we have access,
3036,Instagram yappakistan,2022-05-22 09:08:12,waqr_ad,downloaded the app 2 weeks ago waiting for it ,
3037,Instagram yappakistan,2022-05-22 09:24:45,haseeb.kundi,Can we use this card globally or just in uae,
3038,Instagram yappakistan,2022-05-22 15:31:23,dr.rajkhatri,When its coming to pakistan,
3039,Instagram yappakistan,2022-05-17 07:36:28,shaheryarpasha,Excited Can t wait for it,
3040,Instagram yappakistan,2022-05-17 07:47:47,jazim04,Is there a release date yet,
3041,Instagram yappakistan,2022-05-17 08:00:14,zulqar.nayn,When it is coming,
3042,Instagram yappakistan,2022-05-17 08:13:29,saad.mazhar_leo,Launch date,
3043,Instagram yappakistan,2022-05-17 11:39:46,hussain_4real,It will launch in 2026,
3044,Instagram yappakistan,2022-05-18 17:56:22,tahasaya04,now that you have sbp approval when will the rollout start,
3045,Instagram yappakistan,2022-05-19 07:19:51,guineapigboy46,Will u offer virtual credit cards for online shopping and can we add money to card through easypaisa or jazz cash,
3046,Instagram yappakistan,2022-05-21 10:08:41,nnoumankhan4,Expected Launch,
3047,Instagram yappakistan,2022-05-23 09:05:29,phaysalme,Cant wait come with higher amount limits,
3048,Instagram yappakistan,2022-05-13 12:30:30,oyee_ahmed,Cant wait,
3049,Instagram yappakistan,2022-05-13 14:01:29,umixsticsx,Maybe Coming In Next Week,
3050,Instagram yappakistan,2022-05-17 23:42:42,shamsmalik,Cant wait ,
3051,Instagram yappakistan,2022-05-18 12:06:47,why.zian,When are you guys launching officially in pakistan,
3052,Instagram yappakistan,2022-05-11 12:15:53,malik_writer_official,Congratulations Yap All Team,
3053,Instagram yappakistan,2022-05-11 12:41:29,jbrv.n,bro how long for services,
3054,Instagram yappakistan,2022-05-11 13:13:24,famousbeings,We can get you to 50k followers in just few hours Pls dm us for costs and more information,
3055,Instagram yappakistan,2022-05-11 16:54:20,khizar9944,Guys when You re going to announce Can t wait,
3056,Instagram yappakistan,2022-05-11 18:28:25,chsaqibashraf,Ive downloaded it only gives option for UAE users,
3057,Instagram yappakistan,2022-05-11 21:23:39,megaone.pak,I am guessing it will be same like NayaPay and SadaPay,
3058,Instagram yappakistan,2022-05-12 09:58:29,haroon.roonie.7,Don t delay for months like SadaPay please,
3059,Instagram yappakistan,2022-05-12 15:57:09,ghanirehman1234,,
3060,Instagram yappakistan,2022-05-08 10:57:14,kainatzulqarnain,,
3061,Instagram yappakistan,2022-05-08 10:59:22,inward_eye,,
3062,Instagram yappakistan,2022-05-08 18:52:23,haroon.roonie.7,Eagerly waiting for the launch in Pakistan,
3063,Instagram yappakistan,2022-05-09 19:17:33,nida.azhar3,When theyll launch in pakistan ,
3064,Instagram yappakistan,2022-05-10 06:53:45,malik_writer_official,,
3065,Instagram yappakistan,2022-05-10 13:25:08,sugar_baby_0192,Please launch in pakistan,
3066,Instagram yappakistan,2022-05-11 08:04:40,waqasbhatti189,yappakistan why are you calling it YappPakistan when the app doesnt even allow Pakistani number,
3067,Instagram yappakistan,2022-05-03 04:12:31,oahsan17,,
3068,Instagram yappakistan,2022-05-03 04:20:01,umixsticsx,Ab tm log b launch kr do service,
3069,Instagram yappakistan,2022-05-03 15:57:16,lemepakistani,Wouldve been better if we could get eidi on YAP this eid,
3070,Instagram yappakistan,2022-05-03 20:35:54,callfazi,IBAN use international payments or not,
3071,Instagram yappakistan,2022-05-05 01:32:26,mrarsalan96,It s not available in Pakistan Can t Get an account,
3072,Instagram yappakistan,2022-05-06 19:04:38,words_beyond_wisdom,Sadapay works perfectly even for international transactions Use my referral code 1BA4C,
3073,Instagram yappakistan,2022-05-07 12:02:01,fawad_.rafiq,Downloaded the app but its not available for pakistan What a worst marketing team i saw ever in my life,
3074,Instagram yappakistan,2022-05-07 15:59:25,nawaf_qureshi,When is the launch exactly,
3075,Instagram yappakistan,2022-05-02 06:44:42,saad.mazhar_leo,Waiting for your launch,
3076,Instagram yappakistan,2022-05-06 19:05:02,words_beyond_wisdom,Sadapay works perfectly even for international transactions Use my referral code 1BA4C,
3077,Instagram yappakistan,2022-05-09 12:09:11,innoxent78,Waiting,
3078,Instagram yappakistan,2022-05-09 12:17:32,global.interiordecor,Assalam O Alaikum kab tak work in Pakistan global interiordecor,
3079,Instagram yappakistan,2022-05-09 20:47:07,shahzad.wahaj,Will it work abroad too,
3080,Instagram yappakistan,2022-05-09 20:48:26,shahzad.wahaj,Kon say bank ka hy ye card,
3081,Instagram yappakistan,2022-05-10 02:25:37,maharsohail9,,
3082,Instagram yappakistan,2022-05-10 02:40:43,notmethenwhos,Job available,
3083,Instagram yappakistan,2022-05-10 06:08:32,khurram9394,Please chk dm,
3084,Instagram yappakistan,2022-05-10 08:05:53,mrsajjad7,How to apply and ATM card Free,
3085,Instagram yappakistan,2022-05-10 09:00:01,im_abdul_rehman._,Jub apki services a jain taab add show krwana abhi time ni zaya kro,
3086,Instagram yappakistan,2022-05-10 11:02:49,s_s_2_k,amna spamss ye kia a,
3087,Instagram yappakistan,2022-05-10 11:09:42,ikram.ul.qadeer,In which ATM this card will work I mean with which bank u r connected Nd how to transfer funds in it,
3088,Instagram yappakistan,2022-05-10 13:32:41,aaaqib.m,Oh my God Do it I need a bigpay alternative,
3089,Instagram yappakistan,2022-05-10 14:04:59,sahar_e_noor,Need details about this card,
3090,Instagram yappakistan,2022-05-10 15:55:40,uixamjad,,
3091,Instagram yappakistan,2022-05-10 15:56:19,uixamjad,I m Amjad UXUI designer and love this awesome UX and UI  great job,
3092,Instagram yappakistan,2022-05-10 16:35:45,callabdullah.am,Card free ban raha hay kiya,
3093,Instagram yappakistan,2022-05-10 18:01:44,nabeelkhan1,haninawed m kazim7 amin a bhimani ,
3094,Instagram yappakistan,2022-05-10 19:02:12,shahbazpirzada,How to apply hidden secret all charges plz,
3095,Instagram yappakistan,2022-05-10 21:06:29,fisforfaheem,I want a job here,
3096,Instagram yappakistan,2022-05-11 00:32:48,_sarmad._.pvt,ah tesham,
3097,Instagram yappakistan,2022-05-11 00:35:07,moiztahir_619,sadapay wait a min lol,
3098,Instagram yappakistan,2022-05-11 11:37:30,umar.muaaz,Are you offering payment gateway,
3099,Instagram yappakistan,2022-05-11 13:39:27,followback7604,Its like Naya pay card They are giving the card free and there shipping too,
3100,Instagram yappakistan,2022-05-11 15:56:48,hashaam_z,Hey are you an international service or will you work as a national provider Additionally will your cards be enabled for international transactions,
3101,Instagram yappakistan,2022-05-11 16:04:20,owais__ahmed15,Any remote job available,
3102,Instagram yappakistan,2022-05-11 19:37:35,ziddi8881,How to aply ths card,
3103,Instagram yappakistan,2022-05-11 23:57:19,alikhalil101,Please can u guys be quick i been followin and waitin since forever now,
3104,Instagram yappakistan,2022-05-12 04:55:17,mumarwaince,,
3105,Instagram yappakistan,2022-05-12 13:14:52,oye_naeem_tu,I want apply Atm card ,
3106,Instagram yappakistan,2022-05-12 15:26:26,haseeb.kundi,What s is the daily transaction limit of atm card,
3107,Instagram yappakistan,2022-05-12 16:09:03,blacklisted112021,Koe esa scene banayen iss card ka jis pe hum usa Canada k CCs say paisy outar sakin ,
3108,Instagram yappakistan,2022-05-19 13:37:19,aaqib____baloch,your debit cards better be free or else it would be hard to cope up with other payment apps,
3109,Instagram yappakistan,2022-05-19 16:03:28,mian_danish_sultan,As ka seen ha kia ya Pakistan ma applicable ha or as kis k ly ha,
3110,Instagram yappakistan,2022-05-19 16:32:24,fawad.hussain03,When are you launching,
3111,Instagram yappakistan,2022-05-20 21:55:48,bilal_raxxaq,Will the Atm card also used for International Transactions or payment,
3112,Instagram yappakistan,2022-05-21 20:35:14,asadx20,We are waiting but i hope you wont put us into waitlists Take your time and release a polished product,
3113,Instagram yappakistan,2022-05-22 18:49:51,azmatpanhwar,I cant signup,
3114,Instagram yappakistan,2022-05-22 21:15:55,miasimmuhammad,Only posting advertising it continously but not yet allowed any one to join why,
3115,Instagram yappakistan,2022-05-23 17:07:55,zainsidd17,xain b bawa iska kya krna,
3116,Instagram yappakistan,2022-05-24 18:30:57,shiraxmaqsood,Not in pakistan,
3117,Instagram yappakistan,2022-05-25 09:42:56,urdu_romentic_poetry,Waiting ,
3118,Instagram yappakistan,2022-05-25 18:57:18,itx_mudasir.choudhary,Its free,
3119,Instagram yappakistan,2022-05-25 19:44:41,mikail.khan.773,Will we able to pay paypal invoices with these cards,
3120,Instagram yappakistan,2022-05-25 20:04:51,zeeshansarfaraz83,Is credit card or what,
3121,Instagram yappakistan,2022-05-25 21:15:59,nawabzada_sahib,hammadaftab942,
3122,Instagram yappakistan,2022-05-01 17:50:50,faranraza297,How u differ this from normal conversation debit credit card,
3123,Instagram yappakistan,2022-05-01 22:59:32,i_ahmed_aslam,Only available for UAE number Cant seem to register with Pakistani number,
3124,Instagram yappakistan,2022-05-02 05:05:54,itstaby,What s the point of putting out ads if it s not launched yet Can t sign up with a PK phone number Strange marketing,
3125,Instagram yappakistan,2022-05-02 05:10:17,farman.nfarman,How to create Yap account in pakistan how to get card,
3126,Instagram yappakistan,2022-05-02 08:32:20,bilalasim786,abm uiux yeah sadapay ka koi bhen bhai hai kiya,
3127,Instagram yappakistan,2022-05-02 09:04:50,itz_sheikh_00007,Waiting,
3128,Instagram yappakistan,2022-05-02 15:38:52,noumanhafiz,Can you please update regarding the fees,
3129,Instagram yappakistan,2022-05-02 16:16:02,true.rapunzels,yappakistan can we do international transactions Like send money from Pakistan to india,
3130,Instagram yappakistan,2022-05-02 16:57:00,creatorabrar,The service is not working in Pakistan,
3131,Instagram yappakistan,2022-05-02 17:37:11,a_d_i_l._.k_h_a_n,Jo bi comment dek rah is say acha hai Nayapay lelo free me melta hai aur free delivery Yeh sare 1000 aur 1500 fee leta aur hame melkar pagal bana rhy ahu,
3132,Instagram yappakistan,2022-05-02 23:59:42,_not_saim_,What is Yap Similar to pay pal,
3133,Instagram yappakistan,2022-05-03 04:22:01,asad1one,Bhai koi final date announced kro Pakistan me launch ki,
3134,Instagram yappakistan,2022-05-03 16:11:22,gul_e_nayab09,Physical card fees,
3135,Instagram yappakistan,2022-05-03 17:11:20,zeeshanayyazshani,How to apply,
3136,Instagram yappakistan,2022-05-03 20:40:58,pirkanimirkareem,Nice,
3137,Instagram yappakistan,2022-05-03 20:45:46,gulgeeofficial,Fee,
3138,Instagram yappakistan,2022-05-04 01:41:24,zayd_inc,Available on appstore,
3139,Instagram yappakistan,2022-05-04 08:05:53,massage_therapist_faisalabad,,
3140,Instagram yappakistan,2022-05-04 08:45:22,silent__words00,Free hy,
3141,Instagram yappakistan,2022-05-04 11:38:18,muhammadawaiskhan9,Is help in e commerce and eBay Etsy and Amazon tooo,
3142,Instagram yappakistan,2022-05-04 16:52:55,zain.khan3238,As pe to number ni hai,
3143,Instagram yappakistan,2022-05-05 00:55:42,muhammadasimsyed,Just fooling the people by advertising Pakistan international code have not been open to register it Kindly update it,
3144,Instagram yappakistan,2022-05-05 08:19:46,salehmalik20,faaizthekhan Ek or ,
3145,Instagram yappakistan,2022-05-05 10:17:23,afnanav,Straight up sadapay copy,
3146,Instagram yappakistan,2022-05-05 15:51:22,eskay817_,How is it different than our already exisiting bank applications that provide almost all the features needed What is it that youll offer different to what we already have,
3147,Instagram yappakistan,2022-05-05 18:30:27,gulraizbhutto,Union pay hai ya master card ko international payment gateway,
3148,Instagram yappakistan,2022-05-06 03:00:43,carsdailypk,,
3149,Instagram yappakistan,2022-05-06 11:04:34,rizanjumm,When service will start in Pakistan,
3150,Instagram yappakistan,2022-05-06 13:58:47,rokhriz,What kinda card is this,
3151,Instagram yappakistan,2022-05-06 17:52:46,crewycupcake,Can u do International transaction,
3152,Instagram yappakistan,2022-05-06 18:59:30,mahamkhan1700,https www instagram com tv CdOiJs2gWa0 igshid YmMyMTA2M2Y,
3153,Instagram yappakistan,2022-05-06 19:16:23,etoolz.pk,Virtual or physical card free or not,
3154,Instagram yappakistan,2022-05-07 12:39:25,silverpalacejewellers,when it will be launched in pakistan and we are doing only pkr transections,
3155,Instagram yappakistan,2022-05-07 13:55:18,flashhhh_03,Jab pakistan main aao phir ads or profile pr share karna,
3156,Instagram yappakistan,2022-05-07 13:56:02,flashhhh_03,Abhi se karne ka faida hai koi Website se down bhi karliya try karne wala tha k uae ka number mang rha tha wo,
3157,Instagram yappakistan,2022-05-07 21:48:37,miasimmuhammad,Advertising for what when you don t have your products fully acess or accounts to develop Work and concentrate on it first sir,
3158,Instagram yappakistan,2022-05-08 07:05:24,malikfaisal15,mianbabar10,
3159,Instagram yappakistan,2022-05-08 09:09:44,shaheer.ajmal,Pace your add up Too slow to not scroll,
3160,Instagram yappakistan,2022-05-08 11:37:23,muhammad_atif_mehmood,When this will launch in Pakistan,
3161,Instagram yappakistan,2022-05-09 03:51:25,sh.m.waqar,What is it,
3162,Instagram yappakistan,2022-04-29 15:44:44,raheelzak,Hey man i am too excited,
3163,Instagram yappakistan,2022-04-29 16:12:43,imusa02,Anxiously waiting for that,
3164,Instagram yappakistan,2022-04-29 16:13:43,imusa02,Any hint of when are you starting your roll out or early access plan,
3165,Instagram yappakistan,2022-04-29 16:52:33,khubaibamir,Any b2b associations yet,
3166,Instagram yappakistan,2022-04-29 18:11:45,9988zia,When launching in Pakistan,
3167,Instagram yappakistan,2022-04-29 22:48:28,israr_pakistan,,
3168,Instagram yappakistan,2022-04-30 01:23:18,subhan_jahangeeer,When are tou going to be her ein pak m,
3169,Instagram yappakistan,2022-04-30 03:58:40,m._.abdullah._.khan,sadapay ,
3170,Instagram yappakistan,2022-04-30 04:39:09,sufyan_kamran,Omg the card and packaging design both copied from sadapay,
3171,Instagram yappakistan,2022-04-30 06:50:13,surkh_kabootar,Excited,
3172,Instagram yappakistan,2022-04-30 08:14:16,maryamkferoz,murtazafshafi,
3173,Instagram yappakistan,2022-04-30 08:32:42,waleed.siddd,Theres cvv on the back  Thought this would be a number less card,
3174,Instagram yappakistan,2022-04-30 08:48:22,dan__lok00,What is this,
3175,Instagram yappakistan,2022-04-30 10:03:37,rehanbhatti_1,App isn t working can you fix it,
3176,Instagram yappakistan,2022-04-30 12:34:16,alynhydr,sadapay,
3177,Instagram yappakistan,2022-04-30 13:49:43,0hjuhdh,how u differ this frm normal conventional debit credit card,
3178,Instagram yappakistan,2022-04-30 14:27:20,_buttercup._1,Card charges,
3179,Instagram yappakistan,2022-04-30 16:05:26,iamfaraz.g,,
3180,Instagram yappakistan,2022-04-30 16:35:21,zohair_qureshi,Stop copying and make something of your own,
3181,Instagram yappakistan,2022-04-30 17:17:41,hamza.whatever,Copied from SadaPay,
3182,Instagram yappakistan,2022-04-30 18:26:51,mrdothassan,uae only,
3183,Instagram yappakistan,2022-04-30 18:45:46,_itz._.dany,Still waiting ,
3184,Instagram yappakistan,2022-04-30 18:51:32,vicky_my_heartbeat,Yeh bhi sada pay walo ki tarhan latka kar rakhien gay,
3185,Instagram yappakistan,2022-04-30 20:53:51,fazibnn,How much time more Waiting ,
3186,Instagram yappakistan,2022-04-30 22:09:14,razuawan,Credit card,
3187,Instagram yappakistan,2022-04-30 22:45:28,fazam105,To all respected sir hishamsarwar greenpakistan gfxmentor enablers official enablers official beinggurudotcom barkaansaeed,
3188,Instagram yappakistan,2022-04-30 23:31:23,the_mrimf,mr hamza sheraz haamza iqball ek or card ane wala hai,
3189,Instagram yappakistan,2022-04-30 23:44:34,miasimmuhammad,Firstly increase cluntry list who can join it except uae no numbers to be added kindly allow Pakistan dial code 92 in list to make accout,
3190,Instagram yappakistan,2022-05-01 01:25:22,imbilawalsamoon,Koi bataega Pakistani phone number kyu nai lagrha Sirf dubai phone number mangrha hai,
3191,Instagram yappakistan,2022-05-01 02:45:03,rayanaziz.11,literally Stolen from sadapay ,
3192,Instagram yappakistan,2022-05-01 04:47:35,ibbi_here,Bhot time hai abi ,
3193,Instagram yappakistan,2022-05-01 05:35:35,shaheryar1998,Kya atm transaction free haien,
3194,Instagram yappakistan,2022-05-01 10:35:39,shahrozr.khan,Does this app can work with phone nfc,
3195,Instagram yappakistan,2022-05-01 11:51:52,malik_m.usman.deaf,Nice,
3196,Instagram yappakistan,2022-05-01 12:49:41,zavyarr,le israr Guess ima make space in my wallet for anotha ine,
3197,Instagram yappakistan,2022-05-01 12:54:16,thesheerazaly,sadapay packing style ,
3198,Instagram yappakistan,2022-05-01 13:37:40,saad.mazhar_leo,Waiting,
3199,Instagram yappakistan,2022-04-28 10:48:49,zakirul1,When should i expect Waitlist,
3200,Instagram yappakistan,2022-04-24 10:05:42,maaz_zsz,What is this actually,
3201,Instagram yappakistan,2022-04-24 14:11:53,mahnam.khan16,Cool,
3202,Instagram yappakistan,2022-04-25 10:11:49,adeelayyy,I installed it today but theres just UAE showing up when entering contact number,
3203,Instagram yappakistan,2022-04-26 06:45:14,_itz._.dany,Still waiting ,
3204,Instagram yappakistan,2022-05-06 19:05:50,words_beyond_wisdom,Sadapay works perfectly even for international transactions Use my referral code 1BA4C,
3205,Instagram yappakistan,2022-04-22 18:31:35,m._.moueez,Can we vash out cryptocurrency through this,
3206,Instagram yappakistan,2022-04-19 00:20:19,crushignored,Waiting for the launch eagerly,
3207,Instagram yappakistan,2022-04-19 00:52:35,m._.moueez,Can we cash out bitcoin through this card,
3208,Instagram yappakistan,2022-04-19 15:20:43,richie_rich_malik,eagerly waiting should be better than wise payments ltd,
3209,Instagram yappakistan,2022-04-20 06:01:11,beampakistan,nayapay sadapay tagme pk and now Yap Currently nayapay is leading,
3210,Instagram yappakistan,2022-05-06 11:09:46,thewaqasahmed,Is this only limited for UAE expats,
3211,Instagram yappakistan,2022-05-06 19:06:02,words_beyond_wisdom,Sadapay works perfectly even for international transactions Use my referral code 1BA4C,
3212,Instagram yappakistan,2022-04-12 20:16:47,danishelahi,Can t wait,
3213,Instagram yappakistan,2022-04-13 00:16:57,farooq.jpg,muhammadthelatib,
3214,Instagram yappakistan,2022-04-13 07:05:51,talha.amin.s,Awaiting ,
3215,Instagram yappakistan,2022-04-13 14:36:10,eban.aftabdar,Waiting for it,
3216,Instagram yappakistan,2022-04-13 17:20:13,eban.aftabdar,I have installed app but I cant change my country code,
