,Source,Datetime,Username,Review,Region
0,playstore,2022-09-10 14:32:34,Qasim Manj,Very bad acount i register account for 1 month but acount not active still useles app waste of time,
1,playstore,2022-09-10 04:19:49,Sk Merman,Very good apps  I love this apps,
2,playstore,2022-09-09 15:57:58,sham shaam,Good,
3,playstore,2022-09-09 02:16:00,mohamed raffi,good,
4,playstore,2022-09-07 20:38:13,Ahmed Imran imran,Amazing service got the card in 2 days and account activated the very next day of delivery and also deposited some money,
5,playstore,2022-09-07 11:48:18,Saji Kumar,Very helpful ,
6,playstore,2022-09-06 15:59:31,Team A,Good app  And Tell me about A Card can we get a card free or pay a tax for that well Almost good for trans Or paying money Customer support is not good  Be Better Be Banking ,
7,playstore,2022-09-06 13:20:50,PRAVISHA BALAN,Not working,
8,playstore,2022-09-06 05:57:50,anan salam,For 3 weeks I can t set pin code and there is no technical support no customer service not recommended at all Updating after 5 weeks and still have the same problem They unbelievably bad ,
9,playstore,2022-09-06 02:22:06,Hanabi Zandsir,Very bad I apply now almost one week and waiting for my card is only showing me on the way still I don t receive any written I would receive 48 Hour is almost week very bad experience,
10,playstore,2022-09-05 19:21:39,New Movies Mella,Hello I want to register my ID card it s new one before app didn t accept now giving error talk to support plz help me out to make card as soon as possible,
11,playstore,2022-09-05 18:24:40,John Marzon,Openned an account like a week ago still nothing even it says 48 hours Not interested anymore how do I cancel this,
12,playstore,2022-09-05 18:07:21,Anas Aldouri,DO NOT WASTE YOUR TIME HONESTLY They make the process look simple it s a joke I made an account and got my card after a week of waiting then told me to wait again for the card to be activated and I waited for a week then contacted them and they told me to wait for 48 working hours and the card will be activated After another week I contacted them and they told me due to our internal policy we will not be able to proceed with you account activation DO NOT WASTE YOU TIME believe me,
13,playstore,2022-09-05 13:01:30,dawood sohail,Worst customer service ever it s more 2 months and my card is still not with me,
14,playstore,2022-09-04 11:07:46,Natividad Reyes,Very good,
15,playstore,2022-09-02 13:38:54,AHYSH STONE APPAEAL,I get and lisen good fast and security I believe it it my opening day,
16,playstore,2022-09-02 13:08:21,Chesang Bajracharya,What kind of bank is this after delivering a card still showing a account is in process,
17,playstore,2022-09-01 14:23:14,MR. Memo,Hi it s been almost week for me to trying activate my account I want to know what are you waiting for to activate my account,
18,playstore,2022-09-01 03:38:19,whiley islive,Signup problem,
19,playstore,2022-08-31 23:13:20,Abubakar Shar,Great App For 0 Balance ,
20,playstore,2022-08-31 12:57:16,Nazia Mohd,Very bad experience it s like cheating customers there are many hidden charges If you want to add money also they charge amount Onboarding amount they say we give you aed 50 later they say spend 500 we will give you What the hell who wants to use such app which have to pay on every step,
21,playstore,2022-08-31 12:28:00,TOP ENGSH,Bad app there is no privacy First account opening take 2 month to complete After that you receive many scammers calls and your personal information not safe I have bad experiance of using that,
22,playstore,2022-08-31 07:54:57,Bijay Bomjan,One of the worst digital banking app its been more than 1 week i have received card and its not activated till now,
23,playstore,2022-08-31 04:49:11,Haider Ali,I need change mobile number help me plz,
24,playstore,2022-08-30 01:46:17,Zelle Agang,How to deposit a money if I open this account,
25,playstore,2022-08-29 21:25:37,BIRDS VILLA,I m using this accout from longer but I didn t get any 50,
26,playstore,2022-08-29 18:23:35,Akil Aslam,Joke of an app opened an account about a year back finally reached the top of the queue to complete verification when trying to complete verification i get an error message saying error occured Thanks for the not possible to use debit card,
27,playstore,2022-08-29 17:45:09,AwaiS Ahmad,Very good experience with yap before i open account i read all reviews about the yap account many review are bad so many people not happy with this account now i open account with in 8 days After request they sent my ATM card with in 4 days after 4 days my account properly active now i can use for deposit money  Thank you for upgrade your process,
28,playstore,2022-08-29 15:35:49,Muhammad Ali,Still not activated my account I registered a month off January very bad services,
29,playstore,2022-08-29 09:03:24,DhinesuBaabu Thangavelu,Wonderful customer service Satisfied service for a service based company,
30,playstore,2022-08-28 18:05:39,Basheer Hassan,My yap account still not activated for a very long time i opened the account and i received atm card already but still account not active i wanted to use it but there is no way plz solve my problem,
31,playstore,2022-08-27 21:38:15,NAVEED RAZA,Worst experience shameful,
32,playstore,2022-08-26 10:34:12,RAJENDRA NEPALI,One of the best digital bank ever Good service awesome quick response fast delivery If there is 10 star i give them Really awesome,
33,playstore,2022-08-26 04:25:20,Mohammad Ali,Friends i think this is very good option for zero balence acount i am just open my acount and give full information then active my acount then get my debit card also very fast this is new app may be they will face some technical issues thk u,
34,playstore,2022-08-25 01:17:38,Hamza Shahid,i got my debit card and message from YAP that your Account has been activated but i am trying to open my account on RAK Bank App But RAK bank App is continusly rejecting my card num and my account number what is the issue if YAP is linked with RAK than why my account is not working in RAK MObile banking app,
35,playstore,2022-08-24 19:25:13,Jowhar Lala,Worst banking app ever When I read the other reviews I am taking it as a joke Because it s been more than 8 months my card is not yet activated In between this time period I have opened other accounts and using them for the very next day itself As all others reviewed google should make an option to give negative stars Never ever recommend to anyone If you apply may be you get it activated in the next decade ,
36,playstore,2022-08-24 18:38:37,Abdul Sattar,Lowest process service i applied for account but thay did not process still pending very disappointed,
37,playstore,2022-08-24 16:32:30,Raj Kumar,Excellent digital bank account Customer support is excellent I am very happy to open this account,
38,playstore,2022-08-24 16:20:09,Abdul Qadeer Khalid,Good,
39,playstore,2022-08-24 12:52:38,Saeed Ahmad,Not really happy ,
40,playstore,2022-08-23 23:56:16,Zaki Abbas,wrost application i transfer mony to my home country remitence 3400 dirhm niw 1 week there still not credit and they say already credit now i send bank stetment and they sy our team will be chek and now 1 week team cheking and they didnt give me proper information,
41,playstore,2022-08-23 18:44:56,Salim Salim,The worst company scammers fake promise i wont suggest anyone use this,
42,playstore,2022-08-23 18:20:14,Jamil Malik,Good,
43,playstore,2022-08-23 12:28:18,Rana Waqas,Excellent  progress ,
44,playstore,2022-08-23 11:54:10,Naeem Ahmad,Extremely worst app if i had option to give  I would have given 10 hate this app and the support team I applied for the card 6 months ago and these stupid support team just keep on saying extremely stupid reason and asking for additional documents which is really not needed as I am from a banking background,
45,playstore,2022-08-22 14:03:35,Ehab Younis,      665                    ,
46,playstore,2022-08-21 16:23:54,Haja Mohideen,I have been facing issue with yap since today morning app is not loading in android device Plz do the needful to fix the issue If the app not working Then whats the point going digital,
47,playstore,2022-08-21 12:35:49,Anton,First of all they reviewed my registration after 3 weeks I submitted all documents And now they are asking me for additional document Guess what Answer from support You may provide any document such as a utility bill rental agreement employment contract or even a payment receipt in 2017 ,
48,playstore,2022-08-21 10:54:20,Abdus salam SOWOU,Help us,
49,playstore,2022-08-21 09:45:28,David Boateng,Can YAP send money to ghana,
50,playstore,2022-08-21 08:23:45,Muhammad Asim,To much good,
51,playstore,2022-08-20 17:16:46,Mountain Girl,I will try this,
52,playstore,2022-08-20 17:02:00,Nasif K,They don t give you the signup bonus Its a scam,
53,playstore,2022-08-20 15:55:57,mark anthony Santiago (Mato),Very nice apps,
54,playstore,2022-08-20 01:05:49,MALAYALAM KADHA,Very bad app since 2 week my atm password I can t create and can t use my also my account every day I am calling to customers Care always saying technical issues we are fixing fixing,
55,playstore,2022-08-19 21:18:40,Prince Babar AlbaloOshi,That App Im Using From 3 Months It s Excellent Service Really Very Good And Every Month I Received My Salary My Card Always Working Every times 24 hour And i Do Also International Transaction And Received Payment There in 3 Minutes i don t Know Why some comments Against Service,
56,playstore,2022-08-19 19:27:54,Ah. Emon,Nyc app,
57,playstore,2022-08-19 10:29:14,Nadeem Syed,Good,
58,playstore,2022-08-18 15:41:03,mariya be,This is the worst bank ever U cnt deposit your cheques And the live chat or call center are not helpful at all and are rude Would not recommend it at all,
59,playstore,2022-08-18 12:59:10,Ahmad Alhourani,Very bad service and very bad team and I not recommend it any one to do or try to open account with this app,
60,playstore,2022-08-18 11:22:53,malik Moon,Aslamualikum don t use this app this is too much irritation app i create my account before 3 weeks but pending activation not responsible app please don t use this app,
61,playstore,2022-08-18 10:00:28,Lalit Raj Nath,I had opened an account 10 days back Then I activated my account I deposited AED 100 It was done Then I got my salary and deposited all my salary into the account After that they blocked my account without any notice to me They forced me to beg to others for my daily needs as all my salary is in the accoun I am contacting them everyday their response same we are checking we will inform you I don t know what they are checking worst service Better go for ADCB Hayak zero balance account,
62,playstore,2022-08-18 02:55:57,Md Faisal,Good app,
63,playstore,2022-08-18 01:16:53,Chandra Shekhar,I don t like the way creating bank account,
64,playstore,2022-08-17 22:16:18,Kazi Rabbi,Their service is very bad today about 8 10 days I have problem with my account they are not fixing it,
65,playstore,2022-08-16 21:02:42,syed wasim,Adding funds as well there is a charge,
66,playstore,2022-08-16 20:45:48,Ma.julieta Cresencio,Easy to use,
67,playstore,2022-08-15 22:03:59,ahmad rashed,Great app wait for new card,
68,playstore,2022-08-15 12:39:42,angel zee,Its 10th day i requesting them to recredit my account When i tried to tranfer the mony but it failed twice and the mony was deducted from my account,
69,playstore,2022-08-14 15:49:07,muhammad kashif,Why is it not open very bad,
70,playstore,2022-08-14 06:56:23,Nhio Soyangco,herminio e soyangco jr,
71,playstore,2022-08-13 01:50:48,Arslan Ahmad,Nice beautiful app,
72,playstore,2022-08-13 01:30:02,Ali Hossain,Cannot activate the accaunt,
73,playstore,2022-08-12 19:59:27,shafika jasmin gulam mohideen,It was a very worst app and I opened a online account here on 1month before still it s not activated and I can t able to create a pin I contacted their customer support for n number of times always telling a same reason that was a technical issue and we are resolving it still now I can t able to create pin and can t able to access their digital banking app THIS APP IS THE WORLD S WORST APP EVER Their customer service is also worst,
74,playstore,2022-08-12 18:42:31,Alina Rudenko,Very bad experience I requested for a new bank account 2 weeks ago It was mentioned everywhere that it should take up to 48 hours I needed account asap so I started the process Now after 2 weeks and submitting all the possible documents it was not mentioned anywhere that additional documents are required activation of the account is still in progress I m contacting customers service constantly and colleagues are saying the same thing just give us more time Truly disappointed,
75,playstore,2022-08-10 19:10:25,Warsan Group,Very bad service after one month not the active my account not complete ,
76,playstore,2022-08-10 01:11:01,Shahbaz Ashfaq,Wow its very easy nice active and safe,
77,playstore,2022-08-09 23:04:08,i_melophile,Very poor service Without any matter account got blocked and customer service was unsatisfied Money got stuck in the account,
78,playstore,2022-08-09 17:29:49,Oiana Arcos,They said if you spent 500aed they will give a bonus on sign up and it will be credited first week after the sign up I ve spent 1100aed already and still no bonus and now their saying only POS What is that and they didn t even mention that on their page worst App and liar,
79,playstore,2022-08-09 12:33:05,The Desert Wok 1,This app is not working on iOS 16 please update your app,
80,playstore,2022-08-09 01:27:32,Malik Akhlaq,very good service I create account and with in 48 working hours I receive my debit card the best thing is no minimum balance required and no any monthly fee YAP is the best,
81,playstore,2022-08-08 22:28:52,Zaman Rafique,It s great app im satisfied with it it s good for you also if you know how to use Thank you so much Yap,
82,playstore,2022-08-08 19:51:31,Naseer Alam,Excellent app,
83,playstore,2022-08-07 13:36:39,Dotcom Tv,Well,
84,playstore,2022-08-06 16:02:37,usman nadeem,pakistani bank no ad benifaicry only uae transaction available,
85,playstore,2022-08-06 07:28:10,Mian Saad Chaudhry,It s updated now it s so easy to use,
86,playstore,2022-08-06 05:10:18,Jeevan Kumar,4 months on from application account still inactive Numerous chats phone calls same result,
87,playstore,2022-08-06 03:42:18,Muhammad Umar,,
88,playstore,2022-08-05 21:18:00,dastan di,On 28 of July I had some refund wasn t showing on app after I ask they said it s technical issue and fix it after that I noticed 35 aed is missing from my account I ask them what happened to my money it s been 6 days now they are saying it s technical issue we will fix it after bad service and bad app they are stealing money be careful with this app Today is 5 Aug 2022 and this app stole my money again now 55 23 aed is missing all they saying is technical issue been 10 days now,
89,playstore,2022-08-05 08:53:10,Nisar khan jadoon Nisar khan jadoon,Hi Help its no work induride phone please i want,
90,playstore,2022-08-04 11:20:42,Perla Salgado,friendly and easy to use,
91,playstore,2022-08-04 00:47:43,Bilal Mushtaq,Amazing,
92,playstore,2022-08-03 22:26:27,shamas javid,Good,
93,playstore,2022-08-03 21:08:46,Engineer Ghulam Murtaza,Nice experience with YAP those who are commenting negative they don t have patience to wait everything takes time for verification,
94,playstore,2022-08-03 20:21:47,Vernly Napinas,very helpful,
95,playstore,2022-08-03 15:47:53,Sad Mallik,Bad,
96,playstore,2022-08-03 15:12:40,THAHIR pv,Good,
97,playstore,2022-08-03 14:12:29,Shoaib Shafique,Not good,
98,playstore,2022-08-03 04:32:59,Fahad Mangi,When it will start in Pakistan,
99,playstore,2022-08-02 17:43:07,harshith sundaram,Am trying to use keep on crashing not opening bad experience,
100,playstore,2022-08-02 03:37:50,reggie solis,Hi i have my app but untill now i didnt receive my card,
101,playstore,2022-07-31 20:29:36,Muhammad Bilal,It s show only 97 code not 92 to use in Pakistan,
102,playstore,2022-07-31 18:42:08,Ram Escarcha,I am very disappointed Yap card making doble deduction Yap deducted already the day i loaded then they deduct again without me doing anything I m afraid my hard earned money will eventually loose because of the deduction,
103,playstore,2022-07-30 20:52:36,Jean-baptiste khoury,Very fast easy to use,
104,playstore,2022-07-30 18:14:06,jordia the amble,Its crushing,
105,playstore,2022-07-30 15:10:09,lovers cartoons,After creating an account an received my card now they blocked me,
106,playstore,2022-07-30 10:47:45,Bilal Ahmed,Promotion for Pakistan but sign up not for Pakistan number Very funniest thing salute to your marketing team,
107,playstore,2022-07-30 09:36:08,Muhammad Zobair,Good ,
108,playstore,2022-07-30 00:54:38,Muhammad Daniyal,This is not a bank this is scam company be careful When u install app that time will ask you full access and they will take your all data 1 Someone will call you and ask OTP and start froud 2 Your card details not secure automatically online purchase will start When u call this company they will say you purchased we are not responsible bank is not taking responsibility and we can t do anything this is security reson and we are working on it I lost my 1200 Dirham in this froud company,
109,playstore,2022-07-29 14:41:07,Birkha Budha Chhetri,Excellent ,
110,playstore,2022-07-29 13:45:48,Safa,Very terrible experience It s been over a month and still didn t receive the card Few of the staff who interact on WHATSAPP have absolutely no clue of what they re saying Disgusting And after sometime without even solving the issue they ll send automated messages like we haven t heard from you we are closing this chat now just few seconds after,
111,playstore,2022-07-29 02:09:09,Rhorho Loberiza,suupppperrrr  service they get all your personal details quickly then the will call that your card is out for delivery of courier After you receive it you will wait i don t until when before they will activate your card  Almost 1week updating to customer service they just tell you application rejected how come you waste your time to process everything and send me the card and yet its rejected Hopefully this is not a scam and later on someone will using my personal details,
112,playstore,2022-07-28 23:47:53,Jaguar jani,App stuck on the logo its not working I can t access my account,
113,playstore,2022-07-28 15:55:55,Bryan Allan Camporaso,can t add benificiary to send money to home country,
114,playstore,2022-07-28 13:17:40,UMAIR ARIF,I am very happy after opening account in YAP Its very good and give very good services and every thing perfect ,
115,playstore,2022-07-28 06:54:05,shrijalal “Kumar”,Good apk,
116,playstore,2022-07-28 04:19:45,Somthing new,Good,
117,playstore,2022-07-27 17:43:42,Jiten Pradip,App crashing again n again While logging to my ac it goes to sign up page ask for pin num ask you to wait for otp Otp is not coming from many days thus unable to log in my own account Creators kindly take a note of this issue happening from many months,
118,playstore,2022-07-27 12:27:29,Ishaq Olu,The worst service we can ever imagine as human Plus I will like to let everyone know that yap segregates and doesn t give equity to their customers which is a shame in this present age,
119,playstore,2022-07-26 22:19:07,Adepu Vinesh,Super,
120,playstore,2022-07-26 14:16:02,Saeed Ahmed,Very bad experience this app and yap service,
121,playstore,2022-07-26 03:44:43,Md Rana,Gut,
122,playstore,2022-07-26 01:58:44,Yasir Khan,Very nice,
123,playstore,2022-07-25 18:25:57,Abdulla (cns_3),Finally got my account closed Worse care and a terrible service,
124,playstore,2022-07-25 04:19:10,Rafat Khalil,Hi I would like to ask if there is a restriction for the Syrian Nationality for opening an account with you Thanks,
125,playstore,2022-07-25 03:19:46,Saeed Alzaabi,Very good,
126,playstore,2022-07-24 11:11:55,Saqib Ali,Good experience 2 years,
127,playstore,2022-07-24 09:23:22,Waqas Khan,Good service,
128,playstore,2022-07-24 03:04:44,Muhammad Samiullah,Nice,
129,playstore,2022-07-24 03:04:07,M Asif,V good,
130,playstore,2022-07-23 18:51:26,Shabbir Ullah,Hello do u accept deposit from paypal,
131,playstore,2022-07-22 03:50:24,tajkir mohammad tanvir,Very bad no have any security,
132,playstore,2022-07-22 03:26:22,Sonia Iqbal,I received my card before one month but still not active I am unable to set my pin code they are saying again and time that its a technical problem and we are solving but still same issue,
133,playstore,2022-07-21 16:47:54,Muhammad Hamayun Babar,The absolute worst banking experience I have been registered since the beginning I wish I could give this app less than half a star They closed my account without any warning despite providing them all my documents justifications and answering all of their ridiculous questions Yap is a financial service company that will not respect you as a customer Your experience with yap will be no different than your experience with a terrible bank Yap has failed to deliver on their promises,
134,playstore,2022-07-21 12:04:24,Nihala Tk,Editing my old review and I wish I could give a negative star After submitting all my documents and them ensuring my account won t be blocked again same has repeated That too without any prior notice When I contacted them their answer was the RAK bank is reviewing documents so they block accounts If that was the policy shouldn t a customer receive prior notice so that I can prepare for the blocked period Now I am sitting with a blocked account for a week and nothing is done,
135,playstore,2022-07-21 00:37:29,waleed altaf,Worst application i cant activate my pin,
136,playstore,2022-07-20 22:43:54,Natharsha Abdul Jabbar,Worst app I opened 2 weeks ago Still account not active Custmer rep said always still process So much delay account activation process Dont waste time for follow up,
137,playstore,2022-07-20 11:55:00,Ulfathussain Ulfathussain,Think you,
138,playstore,2022-07-20 03:13:42,Talal,We need islamic products and arabic app,
139,playstore,2022-07-19 17:27:26,Muhammad Atif,Amazing Bank amazing qukily reponse,
140,playstore,2022-07-18 19:27:49,juris corleto,I received my card but activation almost 1 month but its okay 50dhs is in my account without paying anything is fine Thank you,
141,playstore,2022-07-18 10:41:08,Waqar Saab,Understanding,
142,playstore,2022-07-17 17:03:09,jasim khan4 88888888 khan,Vry bed time west,
143,playstore,2022-07-17 06:17:35,Joti Lamsal,This app is very good,
144,playstore,2022-07-17 03:24:09,Vuduh,PATHETIC APP Asked me for all my documents and in the end they are still being reviewed since 3months,
145,playstore,2022-07-16 18:22:34,Maystro,First,
146,playstore,2022-07-15 22:57:43,Saloo,Stupid app Stupid people working behind this Got my card in January still not activated Requested to cancel a month ago but still not done,
147,playstore,2022-07-15 17:06:58,Regina Shcherbinina,The sent me a debit card very quickly but since the 2nd of June there re still reviewing my documents Really I had my accounts in DIB and in another banks in the UAE but this is the first time there s such a long process and issue from their side I am completely amazed because YAP did everything fast for my husband My YAP App says there re still reviewing my documents since June the 17th Can anybody speed it up or again they will blaim Eid holidays,
148,playstore,2022-07-15 12:11:31,Ribier Ahmad Al kenî,They did not open an account for me because of my nationality this is racist,
149,playstore,2022-07-14 04:36:02,gls srilanka,Let s see as just start,
150,playstore,2022-07-13 17:07:44,Asad Raza,This app is so bad I can apply for active They send me a ATM card but my account still under review since 45 days and now my account still under review I have very very bad experience with this app I don t like this app This is west of time don t download it ,
151,playstore,2022-07-13 00:13:17,Mohammad Ibrahim,Nice,
152,playstore,2022-07-12 15:36:44,Mohamed Sherif,Excellent digital banking app for this generation ,
153,playstore,2022-07-12 09:51:18,Basu Kaushalya,Not good,
154,playstore,2022-07-10 15:33:05,Nihas nachu,good,
155,playstore,2022-07-10 03:37:48,Khan,I m Khan for Real estate in UAE Abu Dhabi,
156,playstore,2022-07-09 23:27:14,GUD LUCK,It s like they re correcting our information to use it for something else because it now 2months and plus the account is not activated yet I submit everything now i am no longer need this nonsense delete my information and come for your fake card,
157,playstore,2022-07-09 01:42:47,Haris Tanveer,Good app good experience now I have a total control my finance ,
158,playstore,2022-07-08 23:50:32,Chaudhry Asad ur Rehman,Editing my original 5 star review which banking institution charges fee for DEPOSITING money Pathetic,
159,playstore,2022-07-08 19:30:41,Aquib javed,Very poor coustomer support,
160,playstore,2022-07-08 17:53:55,Fiza Fiza,App not update n alwayes asking update,
161,playstore,2022-07-08 16:32:27,Shahidul Islam,okya,
162,playstore,2022-07-08 16:15:27,Ameya Gamage,Amazing,
163,playstore,2022-07-08 12:23:10,Mohamed Josim,Nice,
164,playstore,2022-07-08 04:46:15,Malik Fahad,Excellent,
165,playstore,2022-07-08 01:44:28,Naig Faith,O I m ml ilpmouh Mml pm O lh omlmpo,
166,playstore,2022-07-07 22:11:44,Rahul Juit,Love this app and service thank you so much ,
167,playstore,2022-07-07 21:38:26,Muhammad Tayyab,Very good product,
168,playstore,2022-07-07 11:43:47,Hiren Paida,Sorry there is no option for zero star you deserve less than this My Atm card still not received even after 15 days its still showing under process after various complaint your executive told me one day you will sure get Atm card  Still after more than 1 months there is no update of my Atm card,
